<?xml version="1.0" encoding="UTF-8"?>
<!--Sample XML file generated by XMLSpy v2010 rel. 3 (http://www.altova.com)-->
<SPRITImageRequest version="1.0" xsi:noNamespaceSchemaLocation="iPCentralProjectImageRequest.xsd" xmlns:xsi="http://www.w3.org/2001/XMLSchema-instance">
	<ClientName>IPCENTRAL</ClientName>
	<ClientRequestId>32</ClientRequestId>
	<Action>IPCentralProjectImage</Action>
	<IPCentralProjectID>ipcentralid101</IPCentralProjectID>
	<FromDate>2001-12-17T09:30:47Z</FromDate>
	<ToDate>2001-12-17T09:30:47Z</ToDate>
	<RequesterUserId>aselvara</RequesterUserId>
</SPRITImageRequest>
